{
  "schema_version": "residual-experiment-registry/1",
  "generated_at": "2026-09-23T23:41:25-04:00",
  "source_boundary": "Documentation-only index assembled from immutable external R4/R4.1 digests and repository research records. Null means not established by inspected evidence. Registry inclusion does not alter, replace, or validate sealed evidence.",
  "experiments": [
    {
      "experiment_id": "EXP-HERMES-R4-001-R4",
      "experiment_family": "R4 qualification",
      "hypothesis": "The candidate satisfies all 17 qualification gates required to advance beyond R4.",
      "preregistration_status": "RETROSPECTIVE",
      "independent_variables": ["candidate revision eada7577cf6f2de875b508c6a82f47870e3aa673", "17-gate R4 qualification schedule"],
      "dependent_variables": ["gate dispositions", "overall qualification disposition", "G11 protected-boundary result", "G13 restart/reconciliation trace"],
      "controls": ["protected-path sentinel", "receiver idempotency", "rollback gate"],
      "baseline": null,
      "code_revision": "eada7577cf6f2de875b508c6a82f47870e3aa673",
      "candidate_revision": "eada7577cf6f2de875b508c6a82f47870e3aa673 (tree f4d144a28166f03aecefa9e27ebaca7b4c621ebe)",
      "model_provider": null,
      "model_digest": null,
      "environment": ["loopback qualification environment", "exact host/runtime manifest not present in repository record"],
      "seed_randomness_policy": null,
      "operator": null,
      "operator_interventions": [],
      "start_timestamp": "2026-09-24T00:54:05Z",
      "end_timestamp": null,
      "evidence_path": ["external-sealed:EXP-HERMES-R4-001/runtime-20260924T005405Z/QUALIFICATION_R4.json", "git:origin/research/r4-qualification-findings:docs/research/R4_R4.1_QUALIFICATION_FINDINGS.md"],
      "evidence_sha256": ["79291ef8c89926ab65832d3075a643616b46b5c61020138b5f9cda1a6a2bf7f6", "e16dfea3390a90fde67dca05a3db5d946bc1fa7d2347fb7186c38a60995af9a3"],
      "outcome": "BLOCKED: 15/17 gates passed; G11 failed before exercising its intended boundary and G13 showed POST before receipt reconciliation after restart.",
      "failure_classification": "R4-F01 QUALIFICATION_INSTRUMENTATION_DEFECT; R4-F02 CANDIDATE_PROTOCOL_DEFECT",
      "replication_count": 1,
      "replication_status": "NOT_REPLICATED",
      "known_confounders": ["G11 stale task snapshot in measurement harness", "single recorded fault schedule", "loopback environment", "receiver idempotency masked retransmission at effect-count level"],
      "interpretation": "R4 falsified the all-gates hypothesis. It separately exposed an instrumentation defect and a sender-side ambiguous-delivery reconciliation defect.",
      "literature_review_status": "NOT_STARTED",
      "metadata_completeness": "INSUFFICIENT",
      "missing_metadata": ["pre-outcome preregistration artifact", "exact environment manifest", "operator identity", "operator intervention log", "end timestamp", "randomness policy", "model/provider applicability statement"]
    },
    {
      "experiment_id": "EXP-HERMES-R4-001-R4.1",
      "experiment_family": "R4.1 corrective qualification",
      "hypothesis": "Corrected G11 instrumentation and receipt-first sender recovery satisfy all R4 gates without modifying protected services or evidence.",
      "preregistration_status": "RETROSPECTIVE",
      "independent_variables": ["candidate revision 8701367db6d3202f24b3eb9f4696b0cadf657985", "authoritative-state reload for G11", "receipt-first restart reconciliation for G13"],
      "dependent_variables": ["17 gate dispositions", "network action ordering after restart", "receiver event count", "protected sentinel digest", "safety counters"],
      "controls": ["malformed tool envelope", "protected-path write attempt", "receipt found", "receipt absent", "reconciliation unavailable", "repeated restart"],
      "baseline": "EXP-HERMES-R4-001-R4",
      "code_revision": "8701367db6d3202f24b3eb9f4696b0cadf657985",
      "candidate_revision": "8701367db6d3202f24b3eb9f4696b0cadf657985 (tree 79bfe6ed1743907065ed44aeb9c460c47527e0c6; parent eada7577cf6f2de875b508c6a82f47870e3aa673)",
      "model_provider": null,
      "model_digest": null,
      "environment": ["loopback qualification environment", "exact host/runtime manifest not present in repository record"],
      "seed_randomness_policy": null,
      "operator": null,
      "operator_interventions": [],
      "start_timestamp": "2026-09-24T02:54:50Z",
      "end_timestamp": null,
      "evidence_path": ["external-sealed:EXP-HERMES-R4-001/runtime-20260924T025450Z/QUALIFICATION_R4.json", "external-sealed:EXP-HERMES-R4-001/SEAL.json", "git:origin/research/r4-qualification-findings:docs/research/R4_R4.1_QUALIFICATION_FINDINGS.md"],
      "evidence_sha256": ["4264bac48a97a3bdfd141d24bc3c898df6bf6b6c2552e76e4b812c2faab7b3b1", "233768e74b3a06ea72c9f1b1a53b7cc522e0b4ffe0d6748ee241c8c7397bf380", "e16dfea3390a90fde67dca05a3db5d946bc1fa7d2347fb7186c38a60995af9a3"],
      "outcome": "READY_FOR_CANARY: 17/17 gates passed, zero unresolved gates; no canary executed.",
      "failure_classification": null,
      "replication_count": 1,
      "replication_status": "NOT_REPLICATED",
      "known_confounders": ["single full qualification pass", "loopback environment", "only receipt-found branch directly exposed in final G13 directory", "no high-concurrency or multi-sender condition"],
      "interpretation": "The recorded candidate passed the bounded qualification. This does not establish universal exactly-once delivery, deployment success, or production readiness.",
      "literature_review_status": "NOT_STARTED",
      "metadata_completeness": "INSUFFICIENT",
      "missing_metadata": ["pre-outcome preregistration artifact", "exact environment manifest", "operator identity", "operator intervention log", "end timestamp", "randomness policy", "model/provider applicability statement"]
    },
    {
      "experiment_id": "EXP-HERMES-R4.1-CANARY-001",
      "experiment_family": "R4.1 bounded continuity canary",
      "hypothesis": "After one ambiguous commit and sender interruption, receipt-first recovery acknowledges locally with zero retransmission and exactly one receiver event.",
      "preregistration_status": "PREREGISTERED",
      "independent_variables": ["single pre-authorized operation", "sender interruption after receiver commit and before local ACK", "receipt-first sender restart"],
      "dependent_variables": ["post-restart GET/POST trace", "receiver event count", "outbox state transitions", "protected-service state", "safety counters", "completion within 120 seconds"],
      "controls": ["exact candidate and seal checks", "clean no-remote worktree", "authorization receipt", "service pre/post comparison", "rollback readiness", "maximum one POST and one receipt lookup"],
      "baseline": "EXP-HERMES-R4-001-R4.1",
      "code_revision": "2bcfc010c48c8d5d8d8b130ea10b3fb1e67583ef",
      "candidate_revision": "8701367db6d3202f24b3eb9f4696b0cadf657985",
      "model_provider": null,
      "model_digest": null,
      "environment": ["pre-designated canary-only project/audience", "deployment-specific adapter and service baseline not yet supplied"],
      "seed_randomness_policy": "No stochastic sampling specified; stable unique operation_id must be fixed before execution.",
      "operator": null,
      "operator_interventions": ["Explicit GO, independent authorization receipt, adapter, evidence destination, and service baseline are required before execution."],
      "start_timestamp": null,
      "end_timestamp": null,
      "evidence_path": ["git:origin/spec/r4.1-canary-package:canary/R4.1/CANARY_SPEC.md"],
      "evidence_sha256": ["3b29c5bd2f4506c8b619317449e05a274a22818cd04cc600ce52df2335254323"],
      "outcome": "NOT_RUN; execution_authorized=false.",
      "failure_classification": null,
      "replication_count": 0,
      "replication_status": "NOT_REPLICATED",
      "known_confounders": ["deployment adapter not selected", "single operation cannot estimate failure probability", "single receiver and fault point"],
      "interpretation": "This is a prospective protocol only. It must remain distinct from completed R4.1 qualification evidence.",
      "literature_review_status": "NOT_STARTED",
      "metadata_completeness": "INSUFFICIENT",
      "missing_metadata": ["operator identity", "execution timestamps", "deployment adapter identity/digest", "environment manifest", "authorization receipt", "operation_id"]
    },
    {
      "experiment_id": "AX21-B0-6-LOCAL7B",
      "experiment_family": "AX-21 verified autonomy",
      "hypothesis": "Useful local-model work can complete a claim-to-verified-candidate path under fail-closed authority and independent verification.",
      "preregistration_status": "RETROSPECTIVE",
      "independent_variables": ["local 7B worker", "BOOTSTRAP-0/P1 control-plane path"],
      "dependent_variables": ["verified candidate completion", "elapsed time", "verifier exception count"],
      "controls": ["external authority checks", "independent verification"],
      "baseline": null,
      "code_revision": null,
      "candidate_revision": null,
      "model_provider": "local 7B via Ollama path; exact artifact not recorded",
      "model_digest": null,
      "environment": ["LEGION (WSL2)", "DELL7320", "DBOX"],
      "seed_randomness_policy": null,
      "operator": null,
      "operator_interventions": [],
      "start_timestamp": null,
      "end_timestamp": null,
      "evidence_path": ["git:origin/docs/ax21-research-baseline:docs/swarm/ax-21-pre-release-baseline.md"],
      "evidence_sha256": ["a104ea27c9f98a9ec4b20ca1c093d2242bab054c01f3e0f569ef172ddf6c041e"],
      "outcome": "One observed path completed in approximately 16.4 seconds without a verifier exception.",
      "failure_classification": null,
      "replication_count": 1,
      "replication_status": "NOT_REPLICATED",